27	495647	false	closed	false	8		2016-01-07T13:01:15Z	2016-07-14T22:22:35Z	2016-07-14T22:22:35Z	Node.js Foundation Technical Steering Committee (TSC) Meeting 2016-01-07	204		
31	495647	false	closed	false	3		2016-01-14T12:39:19Z	2016-07-14T22:23:02Z	2016-07-14T22:23:02Z	Node.js Foundation Technical Steering Committee (TSC) Meeting 2016-01-14	193		
38	495647	false	closed	false	3		2016-01-28T11:54:10Z	2016-07-14T22:24:34Z	2016-07-14T22:24:34Z	Node.js Foundation Technical Steering Committee (TSC) Meeting 2016-01-28	186		
41	495647	false	closed	false	4		2016-02-04T13:40:48Z	2016-07-14T22:25:05Z	2016-07-14T22:25:05Z	Node.js Foundation Technical Steering Committee (TSC) Meeting 2016-02-04	187		
47	579	true	closed	false	4		2016-02-09T22:16:17Z	2016-08-04T16:46:07Z	2016-08-04T16:46:07Z	Migrating to DCO 1.1	10		
49	495647	false	closed	false	2		2016-02-11T11:22:54Z	2016-07-14T22:25:48Z	2016-07-14T22:25:48Z	Node.js Foundation Technical Steering Committee (TSC) Meeting 2016-02-11	214		
63	739813	false	open	false	13		2016-03-10T19:36:56Z	2016-07-14T23:09:17Z		Meeting Calendar	151		
68	739813	false	open	false	18		2016-03-15T20:19:49Z	2016-08-02T18:12:20Z		Meeting videos not under Node.js Youtube account	80		
75	739813	false	closed	false	3		2016-03-23T21:37:23Z	2016-07-20T20:17:59Z	2016-04-29T04:56:44Z	[Discussion] What is the TSC's role?	190		
77	495647	true	open	false	15		2016-03-24T16:23:49Z	2016-07-22T17:19:57Z		Proposed Node.js Foundation Mission, Structure and Strategy	550		
83	1093990	false	closed	false	6		2016-03-28T19:02:36Z	2016-07-31T23:22:24Z	2016-07-31T23:22:24Z	Nominating Kat Marchán to the TSC	190		
92	739813	false	closed	false	6		2016-04-18T17:31:44Z	2016-06-30T16:04:59Z	2016-06-30T12:19:38Z	Developer's Certificate of Origin version	151		
96	45469	false	open	false	41		2016-04-27T22:24:06Z	2016-08-22T20:11:47Z		Investigate moving `nvm` into the foundation	81		
100	579	false	closed	false	21		2016-05-10T23:13:44Z	2016-08-05T13:14:44Z	2016-07-31T23:24:00Z	Legal Committee Meeting on Patents	83		
105	121766	false	closed	false	7		2016-05-26T00:03:31Z	2016-08-01T01:06:44Z	2016-08-01T01:06:44Z	Looking for a volunteer to speak at Node.js Conf Italy	90		
106	495647	false	closed	false	3		2016-06-02T13:11:00Z	2016-07-14T22:26:49Z	2016-07-14T22:26:49Z	Node.js Foundation Technical Steering Committee (TSC) Meeting 2016-06-02	316		
108	739813	true	closed	false	8	0	2016-06-16T05:33:58Z	2016-06-30T20:30:48Z	2016-06-30T20:30:48Z	Add @nebrius as a member of the TSC	82	739813	2016-06-30T20:30:48Z
109	739813	false	open	false	2		2016-06-16T08:24:57Z	2016-08-04T11:50:02Z		Regular roll-up reporting for active working groups	162		
111	739813	true	closed	false	5		2016-06-18T18:01:12Z	2016-07-18T20:12:33Z	2016-07-14T22:20:39Z	add all meeting minutes to date	74		
113	9373002	false	open	false	5		2016-06-20T17:13:30Z	2016-07-05T18:50:40Z		"Define ""Node.js core"" - Mark II"	284		
115	495647	false	closed	false	2		2016-06-30T11:35:49Z	2016-07-31T23:22:52Z	2016-07-31T23:22:52Z	Node.js Foundation Technical Steering Committee (TSC) Meeting 2016-06-30	326		
116	9373002	true	open	false			2016-07-05T18:47:55Z	2016-08-11T19:54:46Z		doc: Add PR for TSC scope	43		
117	739813	false	open	false	6		2016-07-09T22:09:19Z	2016-08-05T18:18:48Z		How is a new repo / project added?	349		
118	495647	false	closed	false	3		2016-07-14T12:49:36Z	2016-07-31T23:22:53Z	2016-07-31T23:22:53Z	Node.js Foundation Technical Steering Committee (TSC) Meeting 2016-07-14	425		
119	739813	true	closed	false	4	1	2016-07-15T00:28:34Z	2016-08-01T00:07:44Z	2016-08-01T00:07:44Z	2016-06-30 and 2016-07-14 meeting minutes	14	739813	2016-08-01T00:07:44Z
120	495647	false	open	false	4		2016-07-28T07:24:42Z	2016-07-29T21:18:22Z		DEFER PROPOSAL: Node.js Foundation Technical Steering Committee (TSC) Meeting 2016-07-28	92		
121	439929	false	open	false	9		2016-07-31T23:18:14Z	2016-08-11T20:02:09Z		#node-dev IRC is not currently under TSC supervision	215		
122	439929	true	open	false	7		2016-07-31T23:52:02Z	2016-08-11T20:02:20Z		doc: cover moderation of IRC, mail, and slack channels	31		
123	237364	true	open	false	0	0	2016-08-03T20:21:21Z	2016-08-03T20:21:21Z		Fix typo	0		
124	495647	false	open	false	0		2016-08-04T11:31:39Z	2016-08-04T20:05:26Z		Node.js Foundation Technical Steering Committee (TSC) Meeting 2016-08-04	444		
125	899444	false	open	false	11		2016-08-04T21:03:02Z	2016-08-11T18:26:07Z		Clarify which people should be org owners	49		
126	579	false	closed	false	14		2016-08-08T14:44:53Z	2016-08-11T20:49:15Z	2016-08-11T20:49:15Z	TSC Board Director Elections	275		
127	1141386	false	open	false	9		2016-08-10T23:44:57Z	2016-08-11T20:03:55Z		Node.js Foundation Technical Steering Committee (TSC) Meeting 2016-08-11	454		
128	439929	false	open	false	7		2016-08-11T20:26:34Z	2016-08-24T17:35:28Z		TSC Elections - One position or two?	79		
129	439929	false	open	false	1		2016-08-11T20:39:34Z	2016-08-24T14:13:16Z		TSC Elections - Nominations	147		
130	1141386	true	open	false	2		2016-08-11T20:58:19Z	2016-08-17T00:20:15Z		Created meeting notes for August 11th 2016 meeting	0		
131	1625870	true	closed	false	4	0	2016-08-13T13:58:41Z	2016-08-15T17:41:00Z	2016-08-15T17:40:59Z	Remove orangemocha from TSC members	7	739813	2016-08-15T17:40:59Z
132	498775	false	open	false	10		2016-08-17T22:43:32Z	2016-08-24T16:47:38Z		Should we modify the guiding principals?	62		
133	1141386	false	open	false	4		2016-08-19T16:36:11Z	2016-08-24T19:27:29Z		Request to migrate Inclusivity Working Group responsibilities to the Node.js Foundation and TSC	411		
