29	332968	false	closed	false	3		2016-06-13T15:59:41Z	2016-07-06T12:39:16Z	2016-07-04T19:52:14Z	Adding David Mark Clements to the WG	25		
30	9373002	false	open	false	11		2016-06-22T20:53:04Z	2016-07-27T21:08:38Z		Repositories to contribute collaboratively	186		
31	9373002	false	open	false	21		2016-06-22T20:59:21Z	2016-07-21T16:16:28Z		Next WG meeting	73		
32	1226256	false	open	false	20		2016-07-05T17:25:26Z	2016-07-25T21:40:04Z		NodeSummit WG Meetup 	110		
33	16722535	false	open	false	7		2016-07-18T11:11:21Z	2016-07-27T09:48:36Z		Proposal for Javascript API for Node core-dump analysis	145		
34	9373002	true	open	false	3		2016-07-21T16:13:28Z	2016-08-03T09:04:32Z		doc: add minutes for July 21 2016	2		
