1	1981088	true	open	false			2017-01-11T22:18:08Z	2017-01-17T05:33:14Z		Add community committee charter	39		
2	739813	true	open	false	0	0	2017-01-11T22:38:30Z	2017-01-11T22:38:30Z		Some formatting changes	21		
3	579	true	open	false			2017-01-11T22:50:30Z	2017-01-12T04:06:19Z		Attempting to clarify some of the language.	0		
4	39992	true	closed	false	1	0	2017-01-12T18:18:16Z	2017-01-13T15:30:36Z	2017-01-13T15:30:36Z	adding myself to colllaborators	12	1981088	2017-01-13T15:30:36Z
5	1163554	true	open	false	1		2017-01-12T18:22:25Z	2017-01-12T20:33:42Z		add ashley to list of contributors	0		
6	498775	true	open	false	0	0	2017-01-12T20:38:53Z	2017-01-12T20:38:53Z		add myles to list of collaborators	20		
7	739813	false	open	false	4		2017-01-14T17:33:25Z	2017-01-17T05:32:02Z		1 Code of Conduct for everything?	81		
