320	20224954	true	closed	false	1		2017-01-11T13:12:12Z	2017-01-17T12:46:21Z	2017-01-17T12:46:21Z	npm: allow npm tmpdir to be set as an env var	30		
321	20224954	true	open	false	2		2017-01-12T11:38:10Z	2017-01-16T16:11:45Z		logger: display 'flaky but passed' modules	25		
322	20224954	true	open	false	2		2017-01-13T11:28:41Z	2017-01-17T18:12:15Z		lookup: updated skip/flaky tags for AIX	5		
323	20224954	true	open	false	1		2017-01-16T14:14:11Z	2017-01-16T15:42:33Z		lookup: add expectFail tag to failing fips modules	11		
324	20224954	false	open	false	0		2017-01-16T14:32:44Z	2017-01-16T15:38:23Z		Add Gibson Fahnestock to the citgm-admins list.	256		
325	20224954	true	open	false			2017-01-16T15:17:39Z	2017-01-24T16:20:35Z		bin: allow custom test path to be used	10		
326	20224954	true	closed	false	0		2017-01-16T16:31:04Z	2017-01-17T08:56:48Z	2017-01-16T21:02:48Z	lookup: mark more fips failures as expectFail	8		
327	20224954	true	closed	false	1		2017-01-16T21:26:34Z	2017-01-17T08:56:58Z	2017-01-16T21:31:15Z	lookup: mark libxmljs flaky on sles and rhel	8		
328	20224954	true	open	false			2017-01-16T23:39:32Z	2017-01-25T09:02:30Z		lookup: update flaky tags	8		
329	498775	false	open	false	0		2017-01-17T17:24:31Z	2017-01-17T17:24:31Z		Flakyness in CI	19		
330	579928	true	closed	false	6		2017-01-18T06:02:26Z	2017-01-19T10:23:03Z	2017-01-19T10:23:03Z	Enable node-sass	53		
331	20224954	true	closed	false	3	0	2017-01-19T09:42:37Z	2017-01-23T15:18:25Z	2017-01-23T15:18:25Z	chore update dependencies	43	20224954	2017-01-23T15:18:25Z
332	20224954	true	closed	false	0	4	2017-01-23T11:57:12Z	2017-01-26T18:59:38Z	2017-01-26T18:59:38Z	docs: include examples in README.md	42	20224954	2017-01-26T18:59:38Z
333	20224954	true	closed	false	0		2017-01-24T13:30:51Z	2017-01-24T22:51:07Z	2017-01-24T13:53:43Z	lookup: skip pug	20		
334	20224954	true	open	false	2		2017-01-24T16:44:30Z	2017-01-25T09:01:17Z		linter: enforce a space after commas	7		
335	20224954	true	closed	false	3		2017-01-26T10:33:06Z	2017-01-26T22:58:38Z	2017-01-26T12:02:20Z	lookup: add prefix to browserify	9		
336	20224954	true	closed	false	2	0	2017-01-26T12:02:58Z	2017-01-26T18:56:32Z	2017-01-26T18:56:32Z	test: add test for local modules	52	20224954	2017-01-26T18:56:32Z
337	20224954	true	open	false	1		2017-01-26T19:15:13Z	2017-01-27T10:27:20Z		eslint: convert to use proper yaml	40		
338	20224954	true	closed	false	0	0	2017-01-26T19:56:47Z	2017-01-27T09:20:32Z	2017-01-27T09:20:32Z	linter: enforce 80 character rule	35	20224954	2017-01-27T09:20:32Z
339	20224954	true	open	false	2		2017-01-26T20:48:39Z	2017-01-30T20:38:29Z		linter: add new linter rules	58		
340	20224954	true	open	false	1		2017-01-30T10:47:35Z	2017-01-30T21:50:30Z		match conditions: fix for rhel and sles x64/x86	187		
341	1093990	false	open	false	2		2017-01-30T17:15:02Z	2017-01-30T22:16:50Z		Release?	28		
